{
  "$schema": "https://json-schema.org/draft/2020-12/schema",
  "$id": "https://garunski.github.io/s_e_e_library/schema/package-meta.schema.json",
  "title": "Package metadata sidecar (s_e_e_package.json)",
  "type": "object",
  "required": ["id", "slug", "category", "name"],
  "properties": {
    "id": { "type": "string", "minLength": 1 },
    "slug": { "type": "string", "minLength": 1 },
    "category": {
      "enum": [
        "workflow",
        "prompt",
        "skill",
        "rule",
        "template",
        "command",
        "bundle",
        "cycle"
      ]
    },
    "name": { "type": "string", "minLength": 1 },
    "description": { "type": "string" },
    "labels": {
      "type": "array",
      "items": { "type": "string", "minLength": 1 }
    },
    "dependencies": {
      "type": "array",
      "items": { "type": "string", "minLength": 1 }
    },
    "toolIds": {
      "type": "array",
      "items": { "type": "string", "minLength": 1 }
    },
    "usageContexts": {
      "type": "array",
      "items": {
        "type": "string",
        "enum": ["cycle", "standalone"]
      }
    },
    "cliScope": { "$ref": "#/$defs/cliScope" },
    "technologyScope": { "$ref": "#/$defs/technologyScope" },
    "technologyIds": {
      "type": "array",
      "items": { "type": "string", "minLength": 1 }
    },
    "releases": {
      "type": "array",
      "items": {
        "type": "object",
        "required": ["version", "date", "note"],
        "properties": {
          "version": { "type": "string", "minLength": 1 },
          "date": { "type": "string", "minLength": 1 },
          "note": { "type": "string", "minLength": 1 }
        }
      }
    }
  },
  "$defs": {
    "cliScope": {
      "oneOf": [
        {
          "type": "object",
          "required": ["scope"],
          "properties": { "scope": { "const": "any" } },
          "additionalProperties": true
        },
        {
          "type": "object",
          "required": ["scope", "cliIds"],
          "properties": {
            "scope": { "const": "specific" },
            "cliIds": {
              "type": "array",
              "minItems": 1,
              "items": { "type": "string", "minLength": 1 }
            }
          },
          "additionalProperties": true
        }
      ]
    },
    "technologyScope": {
      "oneOf": [
        {
          "type": "object",
          "required": ["scope"],
          "properties": { "scope": { "const": "general" } },
          "additionalProperties": true
        },
        {
          "type": "object",
          "required": ["scope"],
          "properties": {
            "scope": { "const": "specific" },
            "technologyIds": {
              "type": "array",
              "items": { "type": "string", "minLength": 1 }
            }
          },
          "additionalProperties": true
        }
      ]
    }
  }
}
