{
  "id": "wf-system-rank-candidates",
  "slug": "system-rank-candidates",
  "category": "workflow",
  "name": "Rank candidate actions",
  "description": "Scores every capability against its bound subjects. Weights, confidence floor, failure threshold, and deprioritize penalty are inputs.",
  "labels": [
    "system"
  ],
  "dependencies": [],
  "toolIds": [],
  "releases": [
    {
      "version": "1.0.0",
      "date": "2026-09-01",
      "note": "Initial catalog release."
    },
    {
      "version": "1.0.1",
      "date": "2026-09-29",
      "note": "Command-neutral agent steps use the project default command."
    }
  ],
  "usageContexts": [
    "cycle"
  ],
  "cliScope": {
    "scope": "any"
  },
  "technologyScope": {
    "scope": "general"
  }
}
