{
  "id": "prompt-system-orchestrator-learning",
  "slug": "system-orchestrator-learning",
  "category": "prompt",
  "name": "Orchestrator learning",
  "description": "Durable notes preamble loaded from the hub prompt store.",
  "labels": [
    "prompt"
  ],
  "dependencies": [],
  "toolIds": [],
  "releases": [
    {
      "version": "1.0.0",
      "date": "2026-09-01",
      "note": "Initial catalog release."
    }
  ],
  "usageContexts": [
    "standalone"
  ],
  "technologyScope": {
    "scope": "general"
  },
  "cliScope": {
    "scope": "any"
  }
}
