{
  "id": "cmd-claude-code",
  "slug": "claude-code",
  "category": "command",
  "name": "Claude Code",
  "description": "Anthropic Claude Code agent CLI run against a spoke workspace.",
  "labels": [
    "command"
  ],
  "dependencies": [],
  "toolIds": [
    "claude"
  ],
  "usageContexts": [
    "standalone"
  ],
  "cliScope": {
    "scope": "specific",
    "cliIds": [
      "claude"
    ]
  },
  "technologyScope": {
    "scope": "general"
  },
  "releases": [
    {
      "version": "1.0.0",
      "date": "2026-09-01",
      "note": "Initial catalog release."
    }
  ]
}
