{
  "id": "prompt-system-stories-from-doc-authoring",
  "slug": "system-stories-from-doc-authoring",
  "category": "prompt",
  "name": "Author stories from doc",
  "description": "",
  "labels": [
    "prompt"
  ],
  "dependencies": [],
  "toolIds": [],
  "releases": [
    {
      "version": "1.0.0",
      "date": "2026-09-01",
      "note": "Initial catalog release."
    },
    {
      "version": "1.0.1",
      "date": "2026-10-20",
      "note": "Read the doc through knowledge_doc_get and defer to repository AGENTS.md rules."
    }
  ],
  "usageContexts": [
    "standalone"
  ],
  "technologyScope": {
    "scope": "general"
  },
  "cliScope": {
    "scope": "any"
  }
}
