{
  "id": "wf-system-generate-milestone-summary-doc",
  "slug": "system-generate-milestone-summary-doc",
  "category": "workflow",
  "name": "Generate milestone summary doc",
  "description": "Resolves a milestone's story ids, drafts a summary with an agent, then persists it as a knowledge doc.",
  "labels": [
    "knowledge",
    "milestone"
  ],
  "dependencies": [
    "prompt-system-milestone-summary-doc"
  ],
  "toolIds": [],
  "releases": [
    {
      "version": "1.0.0",
      "date": "2026-09-01",
      "note": "Initial catalog release."
    },
    {
      "version": "1.0.1",
      "date": "2026-09-29",
      "note": "Command-neutral agent steps use the project default command."
    },
    {
      "version": "1.0.2",
      "date": "2026-10-20",
      "note": "Omit spoke_root so runs use the project default folder, and use the project default agent command."
    }
  ],
  "usageContexts": [
    "standalone"
  ],
  "cliScope": {
    "scope": "any"
  },
  "technologyScope": {
    "scope": "general"
  }
}
