{
  "id": "prompt-system-milestone-authoring",
  "slug": "system-milestone-authoring",
  "category": "prompt",
  "name": "Author milestone",
  "description": "Authors a milestone through MCP store tools.",
  "labels": [
    "milestone"
  ],
  "dependencies": [],
  "toolIds": [],
  "releases": [
    {
      "version": "1.0.0",
      "date": "2026-09-01",
      "note": "Initial catalog release."
    },
    {
      "version": "1.0.1",
      "date": "2026-10-07",
      "note": "Evidence-first contract and the shared MCP fragment."
    },
    {
      "version": "1.0.2",
      "date": "2026-10-11",
      "note": "Named milestone tools replace item_fetch and item_call."
    },
    {
      "version": "1.0.3",
      "date": "2026-10-20",
      "note": "Drop hub-specific decision references."
    }
  ],
  "usageContexts": [
    "standalone"
  ],
  "technologyScope": {
    "scope": "general"
  },
  "cliScope": {
    "scope": "any"
  }
}
