{
  "id": "wf-system-observe-outcome",
  "slug": "system-observe-outcome",
  "category": "workflow",
  "name": "Judge outcome against intent",
  "description": "Compares a finished execution against the intent the proposal claimed and writes a structured outcome judgment.",
  "labels": [
    "system"
  ],
  "dependencies": [],
  "toolIds": [],
  "releases": [
    {
      "version": "1.0.0",
      "date": "2026-09-01",
      "note": "Initial catalog release."
    },
    {
      "version": "1.0.1",
      "date": "2026-09-29",
      "note": "Command-neutral agent steps use the project default command."
    }
  ],
  "usageContexts": [
    "cycle"
  ],
  "cliScope": {
    "scope": "any"
  },
  "technologyScope": {
    "scope": "general"
  }
}
