{
  "id": "skill-workflow",
  "slug": "workflow",
  "category": "skill",
  "name": "workflow",
  "description": "Create or revise S.E.E. workflow definitions and Library workflow packages.",
  "labels": [
    "skill"
  ],
  "dependencies": [],
  "toolIds": [
    "claude",
    "cursor"
  ],
  "usageContexts": [
    "standalone"
  ],
  "cliScope": {
    "scope": "specific",
    "cliIds": [
      "claude",
      "cursor"
    ]
  },
  "technologyScope": {
    "scope": "general"
  },
  "releases": [
    {
      "version": "1.0.0",
      "date": "2026-09-01",
      "note": "Initial catalog release."
    },
    {
      "version": "1.0.1",
      "date": "2026-09-29",
      "note": "Use workflow store tools and explicit command selection."
    },
    {
      "version": "1.0.2",
      "date": "2026-10-20",
      "note": "Omit spoke_root by default and drop path tokens."
    }
  ]
}
