{
  "id": "prompt-system-workflow-authoring",
  "slug": "system-workflow-authoring",
  "category": "prompt",
  "name": "Author workflow",
  "description": "",
  "labels": [
    "prompt"
  ],
  "dependencies": [
    "skill-workflow"
  ],
  "toolIds": [],
  "releases": [
    {
      "version": "1.0.0",
      "date": "2026-09-01",
      "note": "Initial catalog release."
    },
    {
      "version": "1.0.1",
      "date": "2026-09-29",
      "note": "Use the workflow skill and workflow store."
    },
    {
      "version": "1.0.2",
      "date": "2026-10-20",
      "note": "Omit spoke_root by default and drop hub-specific references."
    }
  ],
  "usageContexts": [
    "standalone"
  ],
  "technologyScope": {
    "scope": "general"
  },
  "cliScope": {
    "scope": "any"
  }
}
