{
  "id": "wf-system-author-story",
  "slug": "system-author-story",
  "category": "workflow",
  "name": "Author story from description",
  "description": "Runs the project default command with the story-authoring prompt. The agent writes the story through store tools.",
  "labels": [
    "story"
  ],
  "dependencies": [
    "prompt-system-story-authoring"
  ],
  "toolIds": [],
  "releases": [
    {
      "version": "1.0.0",
      "date": "2026-09-01",
      "note": "Initial catalog release."
    },
    {
      "version": "1.0.1",
      "date": "2026-09-29",
      "note": "Command-neutral agent steps use the project default command."
    },
    {
      "version": "1.0.2",
      "date": "2026-10-07",
      "note": "Passes milestone context and keeps standalone requests valid."
    }
  ],
  "usageContexts": [
    "standalone"
  ],
  "cliScope": {
    "scope": "any"
  },
  "technologyScope": {
    "scope": "general"
  }
}
