{
  "id": "bundle-generate-milestone-summary",
  "slug": "generate-milestone-summary",
  "category": "bundle",
  "name": "Generate milestone summary",
  "description": "Workflow and prompt that draft a knowledge doc from a milestone's stories.",
  "labels": [
    "knowledge",
    "milestone"
  ],
  "dependencies": [],
  "toolIds": [],
  "releases": [
    {
      "version": "1.0.0",
      "date": "2026-09-01",
      "note": "Initial catalog release."
    },
    {
      "version": "1.0.1",
      "date": "2026-10-20",
      "note": "Install the generic skills and prompts, and workflows that default their folder and agent command."
    }
  ],
  "usageContexts": [
    "standalone"
  ],
  "cliScope": {
    "scope": "any"
  },
  "technologyScope": {
    "scope": "general"
  }
}
