{
  "id": "cycle-knowledge-default",
  "slug": "cycle-knowledge-default",
  "category": "cycle",
  "name": "Knowledge default",
  "description": "The seven-stage knowledge loop as a cycle document for the knowledge host.",
  "labels": [
    "cycle",
    "knowledge"
  ],
  "dependencies": [
    "bundle-knowledge-system"
  ],
  "toolIds": [],
  "usageContexts": [
    "cycle"
  ],
  "cliScope": {
    "scope": "any"
  },
  "technologyScope": {
    "scope": "general"
  },
  "releases": [
    {
      "version": "1.0.0",
      "date": "2026-09-01",
      "note": "Initial catalog release."
    }
  ]
}
