{
  "id": "bundle-work-milestone-stories",
  "slug": "work-milestone-stories",
  "category": "bundle",
  "name": "Work milestone stories",
  "description": "Reads every story in a milestone and runs a Cursor CLI agent on each in a loop, marking each Done. Each agent runs the quality task before completing its story.",
  "labels": [
    "bulk",
    "milestone",
    "story"
  ],
  "dependencies": [],
  "toolIds": [],
  "releases": [
    {
      "version": "1.0.0",
      "date": "2026-09-01",
      "note": "Initial catalog release."
    },
    {
      "version": "1.0.1",
      "date": "2026-10-20",
      "note": "Work each story with the store-only work prompt, let the agent set Done after verification, and run the repository quality gate from AGENTS.md."
    }
  ],
  "usageContexts": [
    "standalone"
  ],
  "cliScope": {
    "scope": "any"
  },
  "technologyScope": {
    "scope": "general"
  }
}
