{
  "id": "bundle-work-swimlane-stories",
  "slug": "work-swimlane-stories",
  "category": "bundle",
  "name": "Work swimlane stories",
  "description": "Packages linked by template references: workflows, prompts, skills, commands.",
  "labels": [
    "bulk",
    "story",
    "swimlane"
  ],
  "dependencies": [],
  "toolIds": [],
  "releases": [
    {
      "version": "1.0.0",
      "date": "2026-09-01",
      "note": "Initial catalog release."
    },
    {
      "version": "1.0.1",
      "date": "2026-09-29",
      "note": "Refresh embedded work skill and implementation prompt."
    },
    {
      "version": "1.0.2",
      "date": "2026-10-20",
      "note": "Install the generic skills and prompts, and workflows that default their folder and agent command."
    }
  ],
  "usageContexts": [
    "standalone"
  ],
  "cliScope": {
    "scope": "any"
  },
  "technologyScope": {
    "scope": "general"
  }
}
