{
  "id": "prompt-system-implement-story",
  "slug": "system-implement-story",
  "category": "prompt",
  "name": "Implement story",
  "description": "",
  "labels": [
    "prompt"
  ],
  "dependencies": [
    "skill-work"
  ],
  "toolIds": [],
  "releases": [
    {
      "version": "1.0.0",
      "date": "2026-09-01",
      "note": "Initial catalog release."
    },
    {
      "version": "1.0.1",
      "date": "2026-09-29",
      "note": "Use the work skill and project store without direct story file edits."
    },
    {
      "version": "1.0.2",
      "date": "2026-10-20",
      "note": "Load the work skill from the project home and read the story with story_get."
    }
  ],
  "usageContexts": [
    "standalone"
  ],
  "technologyScope": {
    "scope": "general"
  },
  "cliScope": {
    "scope": "any"
  }
}
