{
  "id": "bundle-author-story",
  "slug": "author-story",
  "category": "bundle",
  "name": "Author story from description",
  "description": "Packages linked by template references: workflows, prompts, skills, commands.",
  "labels": [
    "story"
  ],
  "dependencies": [],
  "toolIds": [],
  "releases": [
    {
      "version": "1.0.0",
      "date": "2026-09-01",
      "note": "Initial catalog release."
    },
    {
      "version": "1.0.1",
      "date": "2026-09-29",
      "note": "Refresh embedded work skill."
    },
    {
      "version": "1.0.2",
      "date": "2026-10-07",
      "note": "Evidence-first prompt and milestone context on the author-story workflow."
    },
    {
      "version": "1.0.3",
      "date": "2026-10-19",
      "note": "Verify commands, prerequisites, resource budgets, workflow compatibility, and acceptance evidence before story handoff."
    }
  ],
  "usageContexts": [
    "standalone"
  ],
  "cliScope": {
    "scope": "any"
  },
  "technologyScope": {
    "scope": "general"
  }
}
